{
  "schema_version": 2,
  "campaign_id": "snd-fresh-backtest-2026-09-16",
  "created_at": "2026-09-16T00:00:00Z",
  "protocol_path": "research/snd-fresh-backtest-2026-09-16/PLAN.json",
  "summary_paths": [
    "research/snd-fresh-backtest-2026-09-16/REPORT.md"
  ],
  "artifacts": [
    {
      "role": "protocol",
      "relative_path": "research/snd-fresh-backtest-2026-09-16/PLAN.json",
      "bytes": 12428,
      "sha256": "07c3c08ecaa453daddd523fe366e964a592a96388c16e1110e256fcfaad79840"
    },
    {
      "role": "summary",
      "relative_path": "research/snd-fresh-backtest-2026-09-16/REPORT.md",
      "bytes": 19412,
      "sha256": "0cf43566bdfbf9f5dc20263894c5a21b7a4de31f53215d0dc2dc94088a7965e8"
    },
    {
      "role": "results",
      "relative_path": "research/snd-fresh-backtest-2026-09-16/results.json",
      "bytes": 265856,
      "sha256": "7f2b15e5a704ae120331175f1fdc8a2758b5e4a23248888a1bb33012d9c2bcec"
    },
    {
      "role": "decisions",
      "relative_path": "research/snd-fresh-backtest-2026-09-16/decisions.json",
      "bytes": 92254,
      "sha256": "b43699c22627e8f1464ebb8d89b814da4a7bea56d5e2566e87bbfb90425bcc37"
    }
  ],
  "consumers": [
    "collective-catalog"
  ]
}
